{
  "$schema": "http://json-schema.org/draft-07/schema#",
  "title": "Profitability Evidence Packet v1",
  "description": "Machine-readable research evidence packet for CDB Profitability Engine candidates. Evidence packets support comparison and review only; they do not authorize paper, micro-live, live capital, runtime changes, or capital scaling.",
  "type": "object",
  "additionalProperties": false,
  "required": [
    "schema_version",
    "evidence_packet_id",
    "candidate_id",
    "generated_at",
    "dataset_id",
    "dataset_fingerprint",
    "source_run_refs",
    "gross_return",
    "net_return",
    "fees",
    "spread_cost",
    "slippage_cost",
    "profit_factor",
    "expectancy",
    "win_rate",
    "avg_win",
    "avg_loss",
    "max_drawdown",
    "loss_streak",
    "trade_count",
    "regime_scorecard",
    "scenario_results",
    "replay_vs_paper_status",
    "simulator_drift",
    "risk_blocks",
    "kill_switch_events",
    "recommendation",
    "limitations",
    "safety_boundaries"
  ],
  "properties": {
    "schema_version": {
      "const": "profitability_evidence_packet.v1"
    },
    "evidence_packet_id": {
      "type": "string",
      "pattern": "^pep-[a-z0-9][a-z0-9-]{2,80}$"
    },
    "candidate_id": {
      "type": "string",
      "pattern": "^cand-[a-z0-9][a-z0-9-]{2,80}$"
    },
    "generated_at": {
      "type": "string",
      "format": "date-time"
    },
    "dataset_id": {
      "type": "string",
      "minLength": 1,
      "maxLength": 160
    },
    "dataset_fingerprint": {
      "type": "string",
      "pattern": "^sha256:[a-f0-9]{64}$"
    },
    "source_run_refs": {
      "type": "array",
      "minItems": 1,
      "uniqueItems": true,
      "items": {
        "type": "string",
        "minLength": 1,
        "maxLength": 300
      }
    },
    "gross_return": {
      "type": "number"
    },
    "net_return": {
      "type": "number"
    },
    "fees": {
      "type": "number",
      "minimum": 0.0
    },
    "spread_cost": {
      "type": "number",
      "minimum": 0.0
    },
    "slippage_cost": {
      "type": "number",
      "minimum": 0.0
    },
    "profit_factor": {
      "oneOf": [
        {
          "type": "null"
        },
        {
          "type": "number",
          "minimum": 0.0
        }
      ],
      "description": "null means the metric could not be reliably computed from the evidence (evidence gap); null is not 0.0 and not a positive result."
    },
    "expectancy": {
      "type": "number"
    },
    "win_rate": {
      "type": "number",
      "minimum": 0.0,
      "maximum": 1.0
    },
    "avg_win": {
      "oneOf": [
        {
          "type": "null"
        },
        {
          "type": "number",
          "minimum": 0.0
        }
      ],
      "description": "null means the metric could not be reliably computed from the evidence (evidence gap); null is not 0.0 and not a positive result."
    },
    "avg_loss": {
      "oneOf": [
        {
          "type": "null"
        },
        {
          "type": "number",
          "minimum": 0.0
        }
      ],
      "description": "null means the metric could not be reliably computed from the evidence (evidence gap); null is not 0.0 and not a positive result."
    },
    "max_drawdown": {
      "oneOf": [
        {
          "type": "null"
        },
        {
          "type": "number",
          "minimum": 0.0
        }
      ],
      "description": "null means the metric could not be reliably computed from the evidence (evidence gap); null is not 0.0 and not a positive result."
    },
    "loss_streak": {
      "type": "integer",
      "minimum": 0
    },
    "trade_count": {
      "type": "integer",
      "minimum": 0
    },
    "regime_scorecard": {
      "type": "object",
      "additionalProperties": false,
      "required": [
        "status",
        "artifact_ref",
        "summary"
      ],
      "properties": {
        "status": {
          "type": "string",
          "enum": [
            "ok",
            "unavailable",
            "insufficient_data"
          ]
        },
        "artifact_ref": {
          "oneOf": [
            {
              "type": "null"
            },
            {
              "type": "string",
              "minLength": 1,
              "maxLength": 300
            }
          ]
        },
        "summary": {
          "type": "string",
          "minLength": 1,
          "maxLength": 1000
        }
      }
    },
    "scenario_results": {
      "type": "array",
      "items": {
        "type": "object",
        "additionalProperties": false,
        "required": [
          "scenario_id",
          "status",
          "net_return",
          "max_drawdown",
          "notes"
        ],
        "properties": {
          "scenario_id": {
            "type": "string",
            "minLength": 1,
            "maxLength": 120
          },
          "status": {
            "type": "string",
            "enum": [
              "PASS",
              "WARNING",
              "FAIL",
              "BLOCKED",
              "NOT_RUN"
            ]
          },
          "net_return": {
            "oneOf": [
              {
                "type": "null"
              },
              {
                "type": "number"
              }
            ]
          },
          "max_drawdown": {
            "oneOf": [
              {
                "type": "null"
              },
              {
                "type": "number",
                "minimum": 0.0
              }
            ]
          },
          "notes": {
            "type": "string",
            "maxLength": 1000
          }
        }
      }
    },
    "replay_vs_paper_status": {
      "type": "string",
      "enum": [
        "aligned",
        "pessimistic_drift",
        "optimistic_drift",
        "ambiguous_drift",
        "missing_reference",
        "not_run"
      ]
    },
    "simulator_drift": {
      "type": "string",
      "enum": [
        "none",
        "pessimistic",
        "optimistic",
        "ambiguous",
        "unusable",
        "not_assessed"
      ]
    },
    "risk_blocks": {
      "type": "integer",
      "minimum": 0
    },
    "kill_switch_events": {
      "type": "integer",
      "minimum": 0
    },
    "recommendation": {
      "type": "string",
      "enum": [
        "REJECT",
        "PARK",
        "PROMOTE_TO_NEXT_RESEARCH_GATE",
        "UNSAFE",
        "NO_RECOMMENDATION"
      ]
    },
    "limitations": {
      "type": "array",
      "items": {
        "type": "string",
        "minLength": 1,
        "maxLength": 500
      }
    },
    "safety_boundaries": {
      "type": "array",
      "minItems": 1,
      "items": {
        "type": "string",
        "minLength": 1,
        "maxLength": 500
      }
    },
    "source_artifacts": {
      "type": "array",
      "minItems": 1,
      "items": {
        "type": "object",
        "additionalProperties": false,
        "required": [
          "artifact_role",
          "path",
          "schema_ref",
          "sha256"
        ],
        "properties": {
          "artifact_role": {
            "type": "string",
            "minLength": 1,
            "maxLength": 120
          },
          "path": {
            "type": "string",
            "minLength": 1,
            "maxLength": 500
          },
          "schema_ref": {
            "type": "string",
            "minLength": 1,
            "maxLength": 300
          },
          "sha256": {
            "type": "string",
            "pattern": "^sha256:[a-f0-9]{64}$"
          }
        }
      }
    },
    "missing_evidence": {
      "type": "array",
      "items": {
        "type": "object",
        "additionalProperties": false,
        "required": [
          "artifact_role",
          "classification",
          "summary"
        ],
        "properties": {
          "artifact_role": {
            "type": "string",
            "minLength": 1,
            "maxLength": 120
          },
          "classification": {
            "type": "string",
            "enum": [
              "OPTIONAL_NOT_PROVIDED",
              "MISSING_REFERENCE",
              "UNAVAILABLE_FROM_INPUT",
              "UNUSABLE_INPUT",
              "AMBIGUOUS_ALIGNMENT"
            ]
          },
          "summary": {
            "type": "string",
            "minLength": 1,
            "maxLength": 1000
          }
        }
      }
    },
    "coverage_readiness": {
      "type": "object",
      "additionalProperties": false,
      "required": [
        "coverage_report_ready",
        "ranking_inputs_complete",
        "data_quality_ready",
        "economics_ready",
        "scenario_ready",
        "replay_ready",
        "replay_vs_paper_ready",
        "regime_scorecard_ready",
        "harvester_refs_ready",
        "summary"
      ],
      "properties": {
        "coverage_report_ready": {
          "type": "boolean"
        },
        "ranking_inputs_complete": {
          "type": "boolean"
        },
        "data_quality_ready": {
          "type": "boolean"
        },
        "economics_ready": {
          "type": "boolean"
        },
        "scenario_ready": {
          "type": "boolean"
        },
        "replay_ready": {
          "type": "boolean"
        },
        "replay_vs_paper_ready": {
          "type": "boolean"
        },
        "regime_scorecard_ready": {
          "type": "boolean"
        },
        "harvester_refs_ready": {
          "type": "boolean"
        },
        "summary": {
          "type": "string",
          "minLength": 1,
          "maxLength": 1000
        }
      }
    },
    "evidence_class": {
      "type": "string",
      "minLength": 1,
      "maxLength": 120,
      "description": "Advisory evidence classification (e.g. controlled_lab_evidence). Descriptive metadata; authorizes nothing."
    },
    "lr_status": {
      "type": "string",
      "minLength": 1,
      "maxLength": 40,
      "description": "Live-Readiness verdict recorded with the packet (e.g. NO-GO). Descriptive only; never a Live/Echtgeld authorization."
    },
    "board_stage": {
      "type": "string",
      "minLength": 1,
      "maxLength": 60,
      "description": "Control-board stage recorded with the packet (e.g. trade-capable). Orthogonal to LR; authorizes no live capital."
    },
    "board_stage_note": {
      "type": "string",
      "minLength": 1,
      "maxLength": 1000,
      "description": "Free-text clarification of board_stage semantics."
    },
    "sample_size_verdict": {
      "type": "string",
      "minLength": 1,
      "maxLength": 60,
      "description": "Advisory sample-size assessment for the packet's aggregate evidence."
    },
    "sample_size_note": {
      "type": "string",
      "minLength": 1,
      "maxLength": 1000,
      "description": "Free-text clarification of the sample_size_verdict."
    },
    "parent_issue": {
      "type": "string",
      "minLength": 1,
      "maxLength": 40,
      "description": "Traceability reference to the parent GitHub issue (e.g. #3032)."
    },
    "child_issue": {
      "type": "string",
      "minLength": 1,
      "maxLength": 40,
      "description": "Traceability reference to a follow-up GitHub issue (e.g. #3152)."
    },
    "strategy_id": {
      "type": "string",
      "minLength": 1,
      "maxLength": 120,
      "description": "Strategy identifier for ARVP campaign candidate packets (#4016)."
    },
    "parameter_fingerprint": {
      "type": "string",
      "minLength": 1,
      "maxLength": 200,
      "description": "Parameter fingerprint for candidate identity; campaign_default when no vector is present."
    },
    "campaign_id": {
      "type": "string",
      "minLength": 1,
      "maxLength": 200,
      "description": "ARVP vacation campaign identifier."
    },
    "source_contract": {
      "type": "string",
      "minLength": 1,
      "maxLength": 120,
      "description": "Upstream normalized metrics contract (e.g. arvp_strategy_metrics.v1)."
    },
    "source_content_hash": {
      "type": "string",
      "pattern": "^[a-f0-9]{64}$",
      "description": "Deterministic SHA-256 hash over upstream metrics bundle records."
    },
    "source_record_count": {
      "type": "integer",
      "minimum": 0,
      "description": "Count of upstream scenario records consumed."
    },
    "source_venue": {
      "type": "string",
      "minLength": 1,
      "maxLength": 120,
      "description": "Research venue label (e.g. Binance Spot BTCUSDT)."
    },
    "source_artifact_references": {
      "type": "array",
      "items": {
        "type": "object",
        "additionalProperties": false,
        "required": ["artifact_role", "schema_ref", "content_hash", "record_count"],
        "properties": {
          "artifact_role": { "type": "string" },
          "schema_ref": { "type": "string" },
          "content_hash": { "type": "string", "pattern": "^[a-f0-9]{64}$" },
          "record_count": { "type": "integer", "minimum": 0 }
        }
      }
    },
    "ranking_ready": {
      "type": "boolean",
      "description": "Explicit ranking readiness flag; must remain false for ARVP cross-venue research."
    },
    "rankability_status": {
      "type": "string",
      "enum": [
        "RANKABLE_FOR_CROSS_VENUE_COMPARISON",
        "NOT_RANKABLE",
        "PARTIAL_EVIDENCE"
      ]
    },
    "rankability_reasons": {
      "type": "array",
      "items": { "type": "string" }
    },
    "paper_reference_status": {
      "type": "string",
      "enum": ["not_run", "aligned", "ambiguous_drift", "missing_reference"]
    },
    "same_venue_status": {
      "type": "string",
      "enum": ["not_run", "confirmed", "not_applicable"]
    },
    "data_quality_flags": {
      "type": "array",
      "items": { "type": "string" }
    },
    "content_hash": {
      "type": "string",
      "pattern": "^[a-f0-9]{64}$",
      "description": "Deterministic SHA-256 hash over packet payload excluding generated_at."
    },
    "arvp_coverage": {
      "type": "object",
      "additionalProperties": false,
      "properties": {
        "purpose_splits": { "type": "array", "items": { "type": "string" } },
        "window_classes": { "type": "array", "items": { "type": "string" } },
        "scenario_coverage": { "type": "array", "items": { "type": "string" } },
        "sample_counts": { "type": "object" },
        "trade_counts": { "type": "object" }
      }
    },
    "arvp_evidence": {
      "type": "object",
      "additionalProperties": false,
      "properties": {
        "economic_metric_summaries": { "type": "array" },
        "scenario_sensitivity": { "type": "array" },
        "split_stability": { "type": "array" },
        "cost_evidence": { "type": "object" },
        "stress_evidence": { "type": "object" }
      }
    }
  }
}
