{
  "schema_version": "profitability_evidence_packet.v1",
  "evidence_packet_id": "pep-primary-breakout-v1-btcusdt-mexc-multi-window-3032",
  "candidate_id": "cand-primary-breakout-v1-btcusdt-mexc-3032",
  "generated_at": "2026-06-13T12:58:00Z",
  "dataset_id": "mexc_multi_window_3032",
  "dataset_fingerprint": "sha256:706181d3f220936963d0ddaf42e526b6f35233eaef9db483a48111519486e855",
  "source_run_refs": [
    "artifacts/candles/mexc_multi_window_3032/window_inventory.json",
    "artifacts/candles/mexc_multi_window_3032/selection_manifest.json",
    "artifacts/candles/mexc_multi_window_3032/window_001/dataset_spec.json",
    "artifacts/candles/mexc_multi_window_3032/window_001/provenance_manifest.json",
    "artifacts/candles/mexc_multi_window_3032/window_001/regime_calibrated/dataset_spec.json",
    "artifacts/candles/mexc_multi_window_3032/window_001/regime_calibrated/calibration_manifest.json",
    "artifacts/replay_reports/mexc_multi_window_3032/window_001/replay-efab7828b8ea-0002/report.json",
    "artifacts/candles/mexc_multi_window_3032/window_002/dataset_spec.json",
    "artifacts/candles/mexc_multi_window_3032/window_002/provenance_manifest.json",
    "artifacts/candles/mexc_multi_window_3032/window_002/regime_calibrated/dataset_spec.json",
    "artifacts/candles/mexc_multi_window_3032/window_002/regime_calibrated/calibration_manifest.json",
    "artifacts/replay_reports/mexc_multi_window_3032/window_002/replay-4bb7b3e46e1b-0002/report.json",
    "artifacts/candles/mexc_multi_window_3032/window_003/dataset_spec.json",
    "artifacts/candles/mexc_multi_window_3032/window_003/provenance_manifest.json",
    "artifacts/candles/mexc_multi_window_3032/window_003/regime_calibrated/dataset_spec.json",
    "artifacts/candles/mexc_multi_window_3032/window_003/regime_calibrated/calibration_manifest.json",
    "artifacts/replay_reports/mexc_multi_window_3032/window_003/replay-8e8561f42f4d-0001/report.json",
    "artifacts/candles/mexc_multi_window_3032/window_004/dataset_spec.json",
    "artifacts/candles/mexc_multi_window_3032/window_004/provenance_manifest.json",
    "artifacts/candles/mexc_multi_window_3032/window_004/regime_calibrated/dataset_spec.json",
    "artifacts/candles/mexc_multi_window_3032/window_004/regime_calibrated/calibration_manifest.json",
    "artifacts/replay_reports/mexc_multi_window_3032/window_004/replay-524e2c03102a-0002/report.json",
    "artifacts/candles/mexc_multi_window_3032/window_005/dataset_spec.json",
    "artifacts/candles/mexc_multi_window_3032/window_005/provenance_manifest.json",
    "artifacts/candles/mexc_multi_window_3032/window_005/regime_calibrated/dataset_spec.json",
    "artifacts/candles/mexc_multi_window_3032/window_005/regime_calibrated/calibration_manifest.json",
    "artifacts/replay_reports/mexc_multi_window_3032/window_005/replay-26d50b3b97a6-0002/report.json",
    "artifacts/candles/mexc_multi_window_3032/window_006/dataset_spec.json",
    "artifacts/candles/mexc_multi_window_3032/window_006/provenance_manifest.json",
    "artifacts/candles/mexc_multi_window_3032/window_006/regime_calibrated/dataset_spec.json",
    "artifacts/candles/mexc_multi_window_3032/window_006/regime_calibrated/calibration_manifest.json",
    "artifacts/replay_reports/mexc_multi_window_3032/window_006/replay-db39444832dc-0002/report.json",
    "artifacts/candles/mexc_multi_window_3032/window_007/dataset_spec.json",
    "artifacts/candles/mexc_multi_window_3032/window_007/provenance_manifest.json",
    "artifacts/candles/mexc_multi_window_3032/window_007/regime_calibrated/dataset_spec.json",
    "artifacts/candles/mexc_multi_window_3032/window_007/regime_calibrated/calibration_manifest.json",
    "artifacts/replay_reports/mexc_multi_window_3032/window_007/replay-d47c7c2c48b1-0002/report.json",
    "artifacts/candles/mexc_multi_window_3032/window_008/dataset_spec.json",
    "artifacts/candles/mexc_multi_window_3032/window_008/provenance_manifest.json",
    "artifacts/candles/mexc_multi_window_3032/window_008/regime_calibrated/dataset_spec.json",
    "artifacts/candles/mexc_multi_window_3032/window_008/regime_calibrated/calibration_manifest.json",
    "artifacts/replay_reports/mexc_multi_window_3032/window_008/replay-5a8820be7608-0002/report.json",
    "artifacts/candles/mexc_multi_window_3032/window_009/dataset_spec.json",
    "artifacts/candles/mexc_multi_window_3032/window_009/provenance_manifest.json",
    "artifacts/candles/mexc_multi_window_3032/window_009/regime_calibrated/dataset_spec.json",
    "artifacts/candles/mexc_multi_window_3032/window_009/regime_calibrated/calibration_manifest.json",
    "artifacts/replay_reports/mexc_multi_window_3032/window_009/replay-d5ef812e6953-0002/report.json",
    "artifacts/candles/mexc_multi_window_3032/window_010/dataset_spec.json",
    "artifacts/candles/mexc_multi_window_3032/window_010/provenance_manifest.json",
    "artifacts/candles/mexc_multi_window_3032/window_010/regime_calibrated/dataset_spec.json",
    "artifacts/candles/mexc_multi_window_3032/window_010/regime_calibrated/calibration_manifest.json",
    "artifacts/replay_reports/mexc_multi_window_3032/window_010/replay-5173e99d0844-0002/report.json",
    "artifacts/candles/mexc_multi_window_3032/window_011/dataset_spec.json",
    "artifacts/candles/mexc_multi_window_3032/window_011/provenance_manifest.json",
    "artifacts/candles/mexc_multi_window_3032/window_011/regime_calibrated/dataset_spec.json",
    "artifacts/candles/mexc_multi_window_3032/window_011/regime_calibrated/calibration_manifest.json",
    "artifacts/replay_reports/mexc_multi_window_3032/window_011/replay-9bffb5578b98-0002/report.json",
    "artifacts/candles/mexc_multi_window_3032/window_012/dataset_spec.json",
    "artifacts/candles/mexc_multi_window_3032/window_012/provenance_manifest.json",
    "artifacts/candles/mexc_multi_window_3032/window_012/regime_calibrated/dataset_spec.json",
    "artifacts/candles/mexc_multi_window_3032/window_012/regime_calibrated/calibration_manifest.json",
    "artifacts/replay_reports/mexc_multi_window_3032/window_012/replay-d7c600737cb3-0002/report.json",
    "artifacts/candles/mexc_multi_window_3032/window_013/dataset_spec.json",
    "artifacts/candles/mexc_multi_window_3032/window_013/provenance_manifest.json",
    "artifacts/candles/mexc_multi_window_3032/window_013/regime_calibrated/dataset_spec.json",
    "artifacts/candles/mexc_multi_window_3032/window_013/regime_calibrated/calibration_manifest.json",
    "artifacts/replay_reports/mexc_multi_window_3032/window_013/replay-c1cb982adba1-0002/report.json",
    "artifacts/candles/mexc_multi_window_3032/window_014/dataset_spec.json",
    "artifacts/candles/mexc_multi_window_3032/window_014/provenance_manifest.json",
    "artifacts/candles/mexc_multi_window_3032/window_014/regime_calibrated/dataset_spec.json",
    "artifacts/candles/mexc_multi_window_3032/window_014/regime_calibrated/calibration_manifest.json",
    "artifacts/replay_reports/mexc_multi_window_3032/window_014/replay-db2a6fde2f0c-0002/report.json",
    "artifacts/candles/mexc_multi_window_3032/window_015/dataset_spec.json",
    "artifacts/candles/mexc_multi_window_3032/window_015/provenance_manifest.json",
    "artifacts/candles/mexc_multi_window_3032/window_015/regime_calibrated/dataset_spec.json",
    "artifacts/candles/mexc_multi_window_3032/window_015/regime_calibrated/calibration_manifest.json",
    "artifacts/replay_reports/mexc_multi_window_3032/window_015/replay-37fd2f7ee6c2-0002/report.json",
    "artifacts/candles/mexc_multi_window_3032/window_016/dataset_spec.json",
    "artifacts/candles/mexc_multi_window_3032/window_016/provenance_manifest.json",
    "artifacts/candles/mexc_multi_window_3032/window_016/regime_calibrated/dataset_spec.json",
    "artifacts/candles/mexc_multi_window_3032/window_016/regime_calibrated/calibration_manifest.json",
    "artifacts/replay_reports/mexc_multi_window_3032/window_016/replay-a7cf11ebde6b-0002/report.json",
    "artifacts/candles/mexc_multi_window_3032/window_017/dataset_spec.json",
    "artifacts/candles/mexc_multi_window_3032/window_017/provenance_manifest.json",
    "artifacts/candles/mexc_multi_window_3032/window_017/regime_calibrated/dataset_spec.json",
    "artifacts/candles/mexc_multi_window_3032/window_017/regime_calibrated/calibration_manifest.json",
    "artifacts/replay_reports/mexc_multi_window_3032/window_017/replay-da49329ac7ac-0002/report.json",
    "artifacts/candles/mexc_multi_window_3032/window_018/dataset_spec.json",
    "artifacts/candles/mexc_multi_window_3032/window_018/provenance_manifest.json",
    "artifacts/candles/mexc_multi_window_3032/window_018/regime_calibrated/dataset_spec.json",
    "artifacts/candles/mexc_multi_window_3032/window_018/regime_calibrated/calibration_manifest.json",
    "artifacts/replay_reports/mexc_multi_window_3032/window_018/replay-f822121c945b-0002/report.json",
    "artifacts/candles/mexc_multi_window_3032/window_019/dataset_spec.json",
    "artifacts/candles/mexc_multi_window_3032/window_019/provenance_manifest.json",
    "artifacts/candles/mexc_multi_window_3032/window_019/regime_calibrated/dataset_spec.json",
    "artifacts/candles/mexc_multi_window_3032/window_019/regime_calibrated/calibration_manifest.json",
    "artifacts/replay_reports/mexc_multi_window_3032/window_019/replay-74efab6903ef-0002/report.json",
    "artifacts/candles/mexc_multi_window_3032/window_020/dataset_spec.json",
    "artifacts/candles/mexc_multi_window_3032/window_020/provenance_manifest.json",
    "artifacts/candles/mexc_multi_window_3032/window_020/regime_calibrated/dataset_spec.json",
    "artifacts/candles/mexc_multi_window_3032/window_020/regime_calibrated/calibration_manifest.json",
    "artifacts/replay_reports/mexc_multi_window_3032/window_020/replay-30ab25ce2374-0002/report.json"
  ],
  "gross_return": -0.07540146169999999,
  "net_return": -0.1221562421,
  "fees": 3489.371874,
  "spread_cost": 0.0,
  "slippage_cost": 0.0,
  "profit_factor": null,